{
  "schema_version": 1,
  "locale": "ru",
  "source_file_sha256": "5a552bec40c3cd56d5e7d78f39c59d45c87134e444300a93c2c2cba0c67a50f9",
  "source_article_sha256": "26eea8fcfa1f5d5e08771fc67b55709f99ea5ffc207953501ac741723243e88c",
  "title": "Витамин D как защита от старения",
  "article_markdown": "# Витамин D как защита от старения\n\n**Авторы:** Fantini Cristina, Corinaldesi Clarissa, Lenzi Andrea, Migliaccio Silvia, Crescioli Clara\n\n**Журнал:** International Journal of Molecular Sciences (2023)\n\n**DOI:** 10.3390/ijms24054546\n\n\n## Аннотация\n\nСтарение можно рассматривать как физиологическое развитие биомолекулярных повреждений и накопление дефектных клеточных компонентов, которые запускают и усиливают процесс ослабления функций всего организма. Старение начинается на клеточном уровне и проявляется неспособностью поддерживать гомеостаз, а также чрезмерной или патологически изменённой экспрессией генов воспалительного, иммунного и стрессового ответа. Старение сопровождается значительными изменениями клеток иммунной системы и ослаблением иммунного надзора, что, в свою очередь, приводит к хроническому усилению воспаления и окислительного стресса и повышает риск сопутствующих заболеваний. Хотя старение — естественный и неизбежный процесс, его могут регулировать некоторые факторы, например образ жизни и питание. Питание воздействует на механизмы молекулярного и клеточного старения. Многие микронутриенты, включая витамины и минеральные элементы, влияют на функции клеток. В этом обзоре рассматривается роль витамина D в защите от старения: он способен формировать клеточные и внутриклеточные процессы и направлять иммунный ответ на защиту от инфекций и возрастных заболеваний. Основные биомолекулярные пути иммунного старения и «воспалительного старения» рассматриваются как биологические мишени витамина D. Также обсуждаются влияние статуса витамина D на функции и дисфункции клеток сердца и скелетных мышц, а также коррекция гиповитаминоза D с помощью питания и добавок. Несмотря на прогресс исследований, сохраняются трудности с переносом полученных знаний в клиническую практику. Поэтому необходимо уделять больше внимания роли витамина D при старении, особенно с учётом роста числа пожилых людей.\n\n\n## 1. Введение\n\nНеоспоримый рост ожидаемой продолжительности жизни и долголетия в развитых странах слишком часто сопровождается снижением качества жизни (QoL) [1]. Иными словами, жить дольше не значит жить лучше; поэтому современная задача — сохранить и улучшить качество жизни на протяжении более долгого периода. Старение представляет собой постепенное снижение функций, которое начинается в раннем взрослом возрасте, продолжается всю жизнь и может приводить к хроническим заболеваниям: например, саркопении, нарушениям обмена веществ, сердечно-сосудистым и нейродегенеративным заболеваниям или раку [2]. Такие заметные возрастные изменения отражают процессы на клеточном и молекулярном уровнях: дисфункция митохондрий, накопление повреждённых белков, эпигенетические изменения, укорочение теломер, патологическая внутриклеточная сигнализация и нарушение восприятия питательных веществ признаны биомолекулярными основами старения [3,4]. В совокупности эти молекулярные нарушения приводят к старческой астении — многомерному синдрому, который клинически характеризуется снижением физиологического резерва и устойчивости к стрессовым воздействиям, а также повышенным риском инвалидности и смерти [5]. Астения, несомненно, имеет множество причин, однако главными её факторами считаются ослабление иммунной защиты, известное как «иммунное старение», и последующее усиление хронического слабовыраженного воспаления, называемого «воспалительным старением». Старение естественно и неостановимо, однако некоторые поддающиеся изменению факторы образа жизни могут улучшать качество жизни, укрепляя иммунную систему и усиливая противовоспалительные процессы.\n\nИзвестно, что питание может направлять состояние здоровья человека как к благополучию, так и к болезни. Сам характер питания играет ключевую роль в здоровом старении, регулируя ряд внутриклеточных процессов.\n\nСреди множества факторов витамин D важен как питательное вещество, способное влиять на процесс старения на клеточном и молекулярном уровнях и оказывать широкий спектр действий.\n\nПомимо нарушений состояния костей, недостаточность витамина D связана с повышенным риском множества заболеваний — от неврологических расстройств до рака, ожирения, диабета и нарушений обмена веществ, сердечно-сосудистых и аутоиммунных заболеваний, инфекций и патологий, связанных с менопаузой [6–13].\n\nВо многих случаях ясная причинно-следственная связь пока не установлена, однако гиповитаминоз D служит маркером плохого здоровья, особенно у пожилых людей, для которых часто характерны сопутствующие заболевания [14].\n\nБольшинство эффектов витамина D обусловлено его тонко регулируемыми иммуномодулирующими свойствами, влияющими на работу иммунной системы и воспаление. Цель этого обзора — описать некоторые клеточные биомеханизмы и биомолекулы, участвующие в иммунном и воспалительном старении и являющиеся мишенями для воздействия витамином D во взрослом возрасте и даже раньше, чтобы по мере старения поддерживать максимально высокий уровень здоровья. Особое внимание будет уделено способности витамина D формировать иммунный статус человека, воздействуя на иммунную систему и связанную с иммунитетом активность некоторых тканей, например скелетных мышц и сердца, функции которых существенно влияют на качество жизни, в том числе в старшем возрасте.\n\n\n## 2. Старение — клеточный и молекулярный процесс\n\nСтарение человека — сложный процесс, на который влияют различные факторы, включая пол, генетику, социально-экономический статус и образ жизни. Возрастные изменения повышают восприимчивость к заболеваниям и связаны с заметными изменениями физиологии всего организма и функций органов, которые, в свою очередь, отражают процессы на клеточном и внутриклеточном уровнях. Накопленные данные позволяют предположить, что питание, наряду с другими факторами, может предотвращать некоторые молекулярные и клеточные изменения, лежащие в основе возрастных заболеваний, и поддерживать функциональные возможности, связанные с благополучием [Всемирная организация здравоохранения, «Старение: здоровое старение и функциональные способности», 2020; https://www.who.int/news-room/questions-and-answers/item/healthy-ageing-and-functional-ability, дата обращения: 26 октября 2020 г.]. Ниже обсуждаются некоторые основные процессы, запускающие и опосредующие клеточное старение и воспаление.\n\n### 2.1. Клеточный путь к старению\n\nПонимание молекулярных причин возрастной мультиморбидности может помочь разработать новые вмешательства и стратегии, замедляющие это состояние [15].\n\nМногофакторный процесс старения включает перестройку различных биологических систем, ведущую к утрате гомеостаза и, как следствие, к ухудшению состояния многих органов и тканей. В этом контексте признано, что возрастные биомолекулярные изменения иммунного ответа и иммунных клеток причинно участвуют в старении всего организма [16]. У людей естественное снижение функций иммунной системы обычно начинается в шестом десятилетии жизни и постепенно приводит к иммунному старению и ослаблению защиты от патогенов; одновременно увеличиваются продолжительность и интенсивность воспалительного ответа [17]. Возрастная «перестройка» как врождённого, так и адаптивного иммунитета может повышать восприимчивость к заболеваниям, способствовать мультиморбидности и старческой астении, а также ухудшать исходы для здоровья [18].\n\nАдаптивный иммунитет ослабевает: антигенспецифический ответ становится слабее, а формирование иммунологической памяти нарушается. В то же время неспецифический врождённый иммунитет чрезмерно активируется, из-за чего пожилой организм остаётся без защиты от хронического воспаления. Совместное наличие этих состояний называют «воспалительным старением» [19,20]. Оно дополнительно повышает риски для пожилых людей, усиливая другие возрастные изменения, связанные с заболеваниями.\n\nМакроскопические изменения отражают микроскопическую перестройку на клеточном и субклеточном уровнях, включая существенные изменения внутриклеточных путей, особенно в репертуаре T-клеток [21–23].\n\nКлеточное старение сочетает морфологические и молекулярные признаки: клетки изменяют регуляцию циклинзависимых киназ (CDK) и переходят в устойчивое состояние необратимой остановки клеточного цикла, отличное от терминальной дифференцировки или покоя [24,25]. Для стареющих клеток характерны уменьшение объёма цитоплазмы, увеличение размера клетки и повышение активности лизосомальной β-галактозидазы — признака, часто используемого как маркер старения. Кроме того, изменяются ДНК и хроматин, повреждаются белки и липиды, нарушаются функции митохондрий и лизосом [24,26,27]. Примечательно, что стареющие клетки демонстрируют «секреторный фенотип, ассоциированный со старением» (SASP), то есть особый секреторный профиль, или «секретом», для которого характерно избыточное выделение провоспалительных молекул, таких как цитокины и хемокины, матриксные металлопротеиназы, а также регуляторы роста и ангиогенеза [28–30]. Схема клеточных изменений при старении показана на рисунке 1.\n\n<figure>\n  <figcaption><strong>Рисунок 1.</strong> Основные клеточные изменения, вызванные старением. К ним относятся морфологические, ферментативные и функциональные изменения.</figcaption>\n</figure>\n\nПри этом усиливаются образование и высвобождение провоспалительных молекул: интерлейкина (IL)-6, IL-1, фактора некроза опухоли (TNF)α, интерферона (IFN)γ, белков острой фазы, активных форм кислорода (АФК) и аутоантител; эти вещества постоянно накапливаются. Они служат посредниками передачи сигналов между клетками органов и тканей и иммунными клетками и тем самым усиливают воспалительное старение [31,32].\n\nНа сегодняшний день многочисленные исследования in vitro и in vivo показывают, что профиль, связанный с клеточным старением, сильно варьирует;